<?xml version="1.0" encoding="utf-8"?>
<Integration xmlns:xsi="http://www.w3.org/2001/XMLSchema-instance" xsi:noNamespaceSchemaLocation="../schemas/Integration.xsd" Name="Mock Deferred Output Test">
    <Steps>
        <SqlInput Id="input1" ConnectionString="Server=invalid;">
            <MockCsv>
Name,Amount
Alice,10
Bob,20
            </MockCsv>
        </SqlInput>
        <Reduce Id="reduce1" OutputField="Sum">
            <InitialStateJson>0</InitialStateJson>
            <Worksheet>
                <Name>Reduce</Name>
                <Cells>
                    <WorkCell>
                        <Id>1</Id>
                        <Name>Sum</Name>
                        <Formula>State + Value(InputRecord.Amount)</Formula>
                        <Comments/>
                    </WorkCell>
                </Cells>
            </Worksheet>
        </Reduce>
        <CsvOutput Id="output1" FilePath="__OUTPUT_PATH__" />
    </Steps>
</Integration>
