<?xml version="1.0" encoding="utf-8"?>
<Integration xmlns:xsi="http://www.w3.org/2001/XMLSchema-instance" xsi:noNamespaceSchemaLocation="../schemas/Integration.xsd" Name="Mock Data Inline Test">
    <Steps>
        <SqlInput Id="input1" ConnectionString="Server=invalid;Database=none;">
            <MockCsv>
Name,Active,Amount
Alice,true,10
Bob,false,100
Cara,true,5
            </MockCsv>
        </SqlInput>
        <Map Id="map">
            <Worksheet>
                <Name>Map</Name>
                <Cells>
                    <WorkCell>
                        <Id>1</Id>
                        <Name>Total</Name>
                        <Formula>Value(InputRecord.Amount) * 2</Formula>
                        <Comments/>
                    </WorkCell>
                </Cells>
            </Worksheet>
        </Map>
    </Steps>
</Integration>
