<?xml version="1.0" encoding="utf-8"?>
<Integration xmlns:xsi="http://www.w3.org/2001/XMLSchema-instance" xsi:noNamespaceSchemaLocation="../schemas/Integration.xsd" Name="CLI Mock Test">
    <Steps>
        <SqlInput Id="sqlInput" ConnectionString="Server=invalid;">
            <MockCsv>
Name,Active,Amount
Alice,true,10
Cara,true,5
            </MockCsv>
        </SqlInput>
        <Map Id="map">
            <Worksheet>
                <Name>Map</Name>
                <Cells>
                    <WorkCell>
                        <Id>1</Id>
                        <Name>Name</Name>
                        <Formula>InputRecord.Name</Formula>
                        <Comments/>
                    </WorkCell>
                    <WorkCell>
                        <Id>2</Id>
                        <Name>Amount</Name>
                        <Formula>Value(InputRecord.Amount)</Formula>
                        <Comments/>
                    </WorkCell>
                </Cells>
            </Worksheet>
        </Map>
        <CsvOutput Id="output" FilePath="__OUTPUT_PATH__" />
    </Steps>
</Integration>
