<?xml version="1.0" encoding="utf-8"?>
<Integration xmlns:xsi="http://www.w3.org/2001/XMLSchema-instance" xsi:noNamespaceSchemaLocation="schemas/Integration.xsd" Name="Switch branches">
    <Steps>
        <IOInput Id="input" Kind="CSVReader" FilePath="Input1.csv" />
        <Switch Id="choose">
            <Worksheet>
                <Cells>
                    <WorkCell>
                        <Id>1</Id>
                        <Name>IsActive</Name>
                        <Formula>InputRecord.Active = &quot;true&quot;</Formula>
                    </WorkCell>
                    <WorkCell>
                        <Id>2</Id>
                        <Name>IsInactive</Name>
                        <Formula>Not IsActive</Formula>
                    </WorkCell>
                </Cells>
            </Worksheet>
            <Branch WorkCell="IsActive">
                <Map Id="yes">
                    <Worksheet>
                        <Cells>
                            <WorkCell>
                                <Id>1</Id>
                                <Name>Result</Name>
                                <Formula>InputRecord.Name &amp; &quot;-yes&quot;</Formula>
                            </WorkCell>
                        </Cells>
                    </Worksheet>
                </Map>
            </Branch>
            <Branch WorkCell="IsInactive">
                <Map Id="no">
                    <Worksheet>
                        <Cells>
                            <WorkCell>
                                <Id>1</Id>
                                <Name>Result</Name>
                                <Formula>InputRecord.Name &amp; &quot;-no&quot;</Formula>
                            </WorkCell>
                        </Cells>
                    </Worksheet>
                </Map>
            </Branch>
        </Switch>
    </Steps>
</Integration>
