<?xml version="1.0" encoding="utf-8"?>
<Integration xmlns:xsi="http://www.w3.org/2001/XMLSchema-instance" xsi:noNamespaceSchemaLocation="../schemas/Integration.xsd" Name="Mock Data File Test">
    <Steps>
        <SqlInput Id="sqlInput" ConnectionString="Server=invalid;" MockCsvFilePath="__MOCK_CSV_PATH__" />
        <Map Id="map">
            <Worksheet>
                <Name>Map</Name>
                <Cells>
                    <WorkCell>
                        <Id>1</Id>
                        <Name>Greeting</Name>
                        <Formula>"Hello " &amp; InputRecord.Name</Formula>
                        <Comments/>
                    </WorkCell>
                </Cells>
            </Worksheet>
        </Map>
    </Steps>
</Integration>
